{
  "id": "nda",
  "title": "Mutual Non-Disclosure Agreement (NDA)",
  "category": "Business",
  "description": "A mutual agreement in which both parties may disclose confidential information to each other and both take on the same obligations to protect it, commonly used before business discussions, partnerships, or joint ventures.",
  "disclaimer": "This is a generic template provided for informational purposes only and is not a substitute for advice from a licensed attorney.",
  "fields": [
    { "key": "effective_date", "label": "Effective Date", "type": "date", "required": true },
    { "key": "party_a_name", "label": "Party A Name", "type": "text", "required": true, "placeholder": "Acme Corp" },
    { "key": "party_a_address", "label": "Party A Address", "type": "textarea", "required": true },
    { "key": "party_a_signatory_name", "label": "Party A Signatory Name", "type": "text", "required": true, "placeholder": "Alex Rivera" },
    { "key": "party_a_signatory_title", "label": "Party A Signatory Title", "type": "text", "required": false, "placeholder": "Chief Executive Officer" },
    { "key": "party_b_name", "label": "Party B Name", "type": "text", "required": true, "placeholder": "Beta Ventures LLC" },
    { "key": "party_b_address", "label": "Party B Address", "type": "textarea", "required": true },
    { "key": "party_b_signatory_name", "label": "Party B Signatory Name", "type": "text", "required": true, "placeholder": "Jordan Lee" },
    { "key": "party_b_signatory_title", "label": "Party B Signatory Title", "type": "text", "required": false, "placeholder": "Managing Director" },
    { "key": "purpose", "label": "Purpose of Disclosure", "type": "textarea", "required": true, "placeholder": "evaluating a potential business relationship" },
    { "key": "term_years", "label": "Confidentiality Term (Years)", "type": "number", "required": true, "placeholder": "2" },
    { "key": "governing_state", "label": "Governing State/Jurisdiction", "type": "text", "required": true, "placeholder": "California" },
    { "key": "governing_county", "label": "Venue (County/City)", "type": "text", "required": false, "placeholder": "San Francisco County" }
  ],
  "body": "MUTUAL NON-DISCLOSURE AGREEMENT\n\nThis Mutual Non-Disclosure Agreement (\"Agreement\") is entered into as of {{effective_date}} (the \"Effective Date\") by and between {{party_a_name}}, located at {{party_a_address}} (\"Party A\"), and {{party_b_name}}, located at {{party_b_address}} (\"Party B\"). Party A and Party B may each be referred to individually as a \"Party\" and collectively as the \"Parties.\"\n\n1. PURPOSE. The Parties wish to explore and engage in discussions related to {{purpose}} (the \"Purpose\"), during which each Party may disclose to the other certain confidential and proprietary information. This Agreement governs the use and protection of that information, regardless of which Party is disclosing or receiving it at a given time.\n\n2. DEFINITION OF CONFIDENTIAL INFORMATION. \"Confidential Information\" means any non-public information disclosed by either Party (the \"Disclosing Party\") to the other (the \"Receiving Party\"), whether disclosed orally, in writing, electronically, or by any other means, and whether or not marked or identified as confidential, that reasonably should be understood to be confidential given the nature of the information and the circumstances of disclosure. Confidential Information includes, without limitation, business plans, financial information, technical data, trade secrets, know-how, product plans, and the existence and terms of this Agreement.\n\n3. EXCLUSIONS. Confidential Information does not include information that the Receiving Party can demonstrate: (a) was already known to the Receiving Party without an obligation of confidentiality prior to disclosure; (b) was or becomes publicly available through no fault of the Receiving Party; (c) was independently developed by the Receiving Party without use of or reference to the Disclosing Party's Confidential Information; or (d) was rightfully received from a third party without breach of any confidentiality obligation.\n\n4. OBLIGATIONS OF RECEIVING PARTY. Each Party, when acting as the Receiving Party, agrees to: (a) hold the other Party's Confidential Information in strict confidence and protect it using at least the same degree of care it uses to protect its own confidential information of similar importance, but in no event less than reasonable care; (b) not disclose the Confidential Information to any third party without the Disclosing Party's prior written consent, except to employees, agents, or advisors who have a need to know and are bound by confidentiality obligations at least as protective as those in this Agreement; and (c) use the Confidential Information solely for the Purpose.\n\n5. COMPELLED DISCLOSURE. If the Receiving Party becomes legally compelled to disclose any Confidential Information, it shall, to the extent legally permitted, provide the Disclosing Party with prompt written notice so that the Disclosing Party may seek a protective order or other appropriate remedy, and shall disclose only the portion of Confidential Information legally required.\n\n6. NO LICENSE; NO OBLIGATION. Nothing in this Agreement grants either Party any license or ownership right in the other Party's Confidential Information. Neither Party is obligated by this Agreement to disclose any information, or to proceed with any business relationship, transaction, or agreement related to the Purpose.\n\n7. RETURN OR DESTRUCTION OF MATERIALS. Upon the Disclosing Party's written request, or upon termination of this Agreement, the Receiving Party shall promptly return or destroy all documents and materials containing the Disclosing Party's Confidential Information, and certify such destruction if requested, except for archival copies retained solely for legal or compliance purposes and still subject to this Agreement.\n\n8. TERM AND SURVIVAL. This Agreement shall remain in effect for {{term_years}} year(s) from the Effective Date, unless terminated earlier by mutual written consent of the Parties. The confidentiality obligations under this Agreement shall survive termination of this Agreement for the duration stated above with respect to Confidential Information disclosed during the term.\n\n9. REMEDIES. Each Party acknowledges that unauthorized use or disclosure of Confidential Information may cause irreparable harm for which monetary damages would be an inadequate remedy, and agrees that the Disclosing Party shall be entitled to seek injunctive relief, in addition to all other remedies available at law or in equity.\n\n10. NO ASSIGNMENT. Neither Party may assign or transfer its rights or obligations under this Agreement without the prior written consent of the other Party, except in connection with a merger, acquisition, or sale of substantially all of its assets.\n\n11. ENTIRE AGREEMENT; AMENDMENT. This Agreement constitutes the entire agreement between the Parties regarding its subject matter and supersedes all prior discussions and agreements on that subject. It may be amended only by a written instrument signed by both Parties.\n\n12. SEVERABILITY. If any provision of this Agreement is held invalid or unenforceable, the remaining provisions shall continue in full force and effect, and the invalid provision shall be modified to the minimum extent necessary to make it enforceable.\n\n13. GOVERNING LAW; VENUE. This Agreement shall be governed by the laws of {{governing_state}}, without regard to its conflict of laws principles. The Parties agree that any dispute arising out of or relating to this Agreement shall be brought exclusively in the state or federal courts located in {{governing_county}}, and each Party consents to the jurisdiction of such courts.\n\n14. NOTICES. Any notice required or permitted under this Agreement shall be in writing and delivered to the address of the receiving Party set forth above, or such other address as a Party may designate in writing.\n\n15. COUNTERPARTS. This Agreement may be executed in counterparts, including electronic signatures, each of which shall be deemed an original, and all of which together shall constitute one and the same instrument.\n\nIN WITNESS WHEREOF, the Parties have executed this Agreement as of the Effective Date.\n\n\nPARTY A: {{party_a_name}}\n\n_______________________________\nSignature\n\n{{party_a_signatory_name}}\nPrinted Name\n\n{{party_a_signatory_title}}\nTitle\n\n\nPARTY B: {{party_b_name}}\n\n_______________________________\nSignature\n\n{{party_b_signatory_name}}\nPrinted Name\n\n{{party_b_signatory_title}}\nTitle"
}
